Priority,Category,Area,Target,Performance Type,Target set,Review Date,Tracking,pid
1,Recovery,Sleep,Increase average sleep by 1hr per night,Habit,07/03/2025,07/05/2025,On Track,1
2,Recovery,Nutrition,45g of carbohydrate every half time,Habit,07/03/2025,07/05/2025,On Track,1
3,Performance,Sprint,>65% in max velocity score,Outcome,07/03/2025,07/05/2025,Achieved,1
4,Performance,Training,Make all the bonus exercices at the end off traning,Habit,07/03/2025,07/05/2025,On Track,2
5,Recovery,Avaibility,Be available for the next 3 games ,Outcome,07/03/2025,07/05/2025,On Track,2
6,Performance,Sprint,Get Muscle recovery Score > 0 ,Outcome,07/03/2025,07/05/2025,On Track,2